county,Name,SymbolID,site_desc,lon,lat
Juneau,28. Necedah National Wildlife Refuge,0,"This 43,696-acre refuge is a magnet for birds and mammals because of its size and the diversity of its landscapes. It was designated as an Important Bird Area and is home to more than 200 species of birds including Trumpeter Swans, songbirds, herons, rails, nearly every species of waterfowl and many kinds of shorebirds. There are miles of roads to drive, trails to hike, and observation decks to climb. Opportunities at Necedah include environmental education, fishing, hunting, interpretation, photography and wildlife observation. <br><br>Phone: 608/565-2551 <br><br>Web: http://midwest.fws.gov/necedah <br><br>Signature Species: Whooping Crane, Eastern Meadowlark, Trumpeter Swan, Osprey & Timber Wolf <br><br>Rare Species: Timber Wolf, Karner Blue Butterfly, Whooping Crane re-instatement area <br><br>Gazetteer: Page 51, D-7 <br><br>Seasonality: Open all year <br><br>Parking: Parking Lots <br><br>Nearest food and lodging: Necedah",-90.169172,44.052434
Marathon,29. Big Eau Pleine County Park & Dells of the Eau Claire River State Natural Area,0,"This beautiful SNA occupies the southern part of the Dells of the Eau Claire County Park and includes a segment of the Ice Age Trail. The park protects a dramatic, narrow gorge where water cascades over rock outcroppings. The gorge and surrounding uplands are wooded with sugar and mountain maple, hemlock, and yellow birch. Canada yew is abundant and spring wildflowers are spectacular. Many species of warblers, sparrows, and thrushes as well as unusual hawks and owls live here including the Northern Saw-whet Owl, Northern Goshawk, Lincoln・・s sparrow and Ruffed Grouse. Bring your camera; this is one photo-op you won・・t want to miss. <br><br>Phone: 715/785-9000 <br><br>Web: www.dnr.wi.gov <br><br>Signature Species: Broadwinged Hawk & Blackburnian Warbler <br><br>Rare species: Long-eared Owl, Scarlet Tanager & Cedar Waxwing <br><br>Gazetteer: Page 77, D-6 <br><br>Parking: Parking areas <br><br>Nearest food & lodging: Wausau",-89.339747,45.006321
Marathon,30. Big Eau Pleine Woods State Natural Area,0,"This 105-acre SNA is located in Big Eau Pleine County Park occupying a peninsula jutting into 6,700-acre Big Eau Pleine Reservoir. It is the area・・s best example of old growth mesic forest. Look for Bald Eagles and Red-shouldered Hawks. Red-necked and Eared Grebes can be seen along with a variety of shorebirds and herons. Overhead, Hooded Warblers hunt for insects in the sugar maple canopy. In the spring, White-throated Sparrows scratch for seeds and insects among the blooming carpet of bloodroot, trillium, violets and hepatica. In the fall, the sugar maple, yellow birch, and red oak put on a colorful show. <br><br>Phone: 715/785-9000 <br><br>Web site: www.dnr.wi.gov <br><br>Signature Species: Cerulean Warbler & Acadian Flycatcher <br><br>Rare species: American White Pelican, Winter Wren & Solitary Sandpiper <br><br>Gazetteer: Page 64, B-2 <br><br>Parking: Parking lots <br><br>Nearest food & lodging: Mosinee",-89.854088,44.755754
Marathon,31. Bluegill Bay County Park,0,"The Wisconsin Society for Ornithology mentions this park as the best site in Wausau to bird watch year round. Located along the Wisconsin River, it has a nice mix of habitats including upland woods, marsh, brushy edges, and a large pond with an outlet to the river. The property・・s bird list boasts 175 species with spring and fall being the best seasons. A spring on the property flows year ・・round making this is a good place for overwintering species. A good trail system provides access to this 70-acre park. Some rare species include the Red-necked Grebe, Yellow-crowned Night-Heron and Summer Tanager. <br><br>Phone: 715/261-1550 <br><br>Web: www.co.marathon.wi.us/ <br><br>Signature Species: Wilson・・s Snipe & Yellow Warbler <br><br>Rare species: Red-necked Grebe, Yellow-crowned Night- Heron, Northern Goshawk, Northern Saw-whet Owl, Pine Grosbeak & Connecticut Warbler. <br><br>Gazetteer: Page 64, A-3 <br><br>Parking: Parking Lot <br><br>Nearest food & lodging: Wausau",-89.639339,44.922272
Marathon,32. George W. Mead State Wildlife Area,0,"This large and diverse property is found in parts of Marathon, Wood and Portage Counties. At 30,000 acres, it boasts a bird list of 248 species. Most species of mammals and many species of reptiles and amphibians found in Wisconsin live here. The Little Eau Pleine River flows through the property. There are flowages, small lakes, marshes, grasslands, tamarack bog and woodland areas to explore. Good roads go to all parts of the property and hiking trails are numerous. Bring your canoe or kayak to explore the water resources. The new Stanton W. Mead Education & Visitor Center demonstrates state-ofthe- art green building technology. <br><br>Phone: 715/457-6771 <br><br>Web: meadwildlife.org, www.dnr.wi.gov <br><br>Signature Species: Bald Eagle, Sandhill Crane, Ruffed Grouse & White Pelican <br><br>Rare species: Greater Prairie Chicken, Sharp-tail Grouse & Loggerhead Shrike <br><br>Gazetteer: Page 64, C-2 <br><br>Parking: Parking lots <br><br>Closest food & lodging: Wausau, Stevens Point & Marshfield",-89.858809,44.721796
Marathon,33. Leigh Yawkey Woodson Art Museum,0,"One simple idea ・・ birds ・・ filtered through the minds and hands of more than 110 artists creates an annual birdthemed exhibition that is always absorbing, thought provoking, and imaginative. The Birds in Art exhibition opens the weekend after Labor Day and remains open for 9-10 weeks. This single event attracts thousands of visitors to this beautiful art museum located in the eastern edge of the Andrew Warren Historic District in Wausau. The museum・・s permanent collection contains many beautiful paintings, carvings and sculptures of birds that can be seen year-round, so a visit anytime will charm birders. <br><br>Phone: 715/845-7010 <br><br>Web: www.lywam.org <br><br>Signature Event: Birds In Art <br><br>Gazetteer: Page 64, A-3 <br><br>Parking: Parking Lot <br><br>Nearest food & lodging: Wausau",-89.60063,44.962733
Marathon,34. Nine-Mile County Forest,0,"This 5,000-acre county forest offers spectacular views of the area. Several of the trails were designed for crosscountry skiing and can be challenging. They do, however, access the site and you will be rewarded with some nice additions to your bird list. The older forest areas attract Cerulean and Hooded Warblers, hawks and flycatchers. Northern Saw-whet, Barred, Screech and Great-horned Owls have all been seen here. Turkey Vultures and Bald Eagles soar overhead. Trails are well marked and benches provide a place to stop, relax and enjoy the view. <br><br>Phone: 715/261-1550 <br><br>Web: www.co.marathon.wi.us/ <br><br>Signature species: Black-billed Cuckoo, Hermit Thrush & Acadian Flycatcher <br><br>Rare species: Red-shouldered Hawk, Yellow-billed Cuckoo, Olive-sided Flycatcher, Pine and Evening Grosbeaks, Common Redpoll & both crossbills. <br><br>Gazetteer: Page 64, A-3 <br><br>Parking: Parking area <br><br>Nearest food & lodging: Wausau <br><br>Fee: Ski pass required in winter",-89.707832,44.887073
Marathon,35. Rib Mountain State Park,0,"Rib Mountain is a billion-year-old hill that is the capstone of this beautiful state park. A 60-foot observation tower atop the hill offers spectacular views of the Rib River and valley. From spring through fall, this park is a great place to watch large numbers of Turkey Vultures, hawks and Bald Eagles glide on the thermals above. In the spring, park woodlands attract large numbers of migrating songbirds, especially warblers. In the summer, it holds Winter Wrens, Yellow-bellied Flycatcher and Tufted Titmice. In the fall, it offers one of the best spots to watch migrating hawks. The park offers 9 miles of hiking trails, 30 campsites and terrific skiing in the winter. <br><br>Phone: 715/ 842-2522 <br><br>Web: wiparks.net <br><br>Signature species: Bald Eagle, Broad-winged Hawk & Osprey <br><br>Rare species: Golden Eagle <br><br>Gazetteer: Page 64, A-3 <br><br>Parking: Parking lots <br><br>Nearest food & lodging: Wausau <br><br>Fee: Park fees apply",-89.676075,44.917957
Marquette,36. Comstock Bog Meadow State Natural Area,0,"This property lies within a large basin in the glaciated Central Plain. It has a quaking bog mat of sedges and sphagnum moss. The alkaline conditions of the water support the growth of unusual plants such as pitcher plant and bog-rosemary. The property changes to a sedge meadow that is treeless and open except for a small area of tamarack, poison sumac, and bog birch. Sandhill Cranes are here by the hundreds in the fall where they rest for migration. Nesting birds around the marsh and sedge meadows include wading birds and some hard-to-find grassland species. <br><br>Phone: 920/787- 4686 <br><br>Web: www.dnr.wi.gov <br><br>Signature species: Sandhill Crane, Sora & Virginia Rail, Bobolink, Leconte・・s & Henslow・・s Sparrow <br><br>Rare species: Yellow Rail & Blueheaded Vireo <br><br>Gazetteer: Page 44, A-2 <br><br>Parking: Parking lot <br><br>Nearest food & lodging: Montello",-89.271641,43.880696
Marquette,37. Germania Marsh State Wildlife Area,0,"This 2,400-acre site is a mix of oak forest, wetlands, sedge meadows and old fields. The Mecan River flows through the property hydrating the wetlands and attracting flocks of waterfowl in the spring and fall. In the summer, the meadows support Karner Blue Butterflies while the marshes hold Blanding・・s turtles. Look for terns as they dive for small minnows or insects. In the spring, listen for the American Woodcock in the aspen thickets at dusk, and hear the drumming of the Ruffed Grouse in the woods. The sky overhead can be filled with migrating Common Night Hawks in late August. Look for Red-tail Hawks and Turkey Vultures soaring overhead, and low-flying Northern Harriers over the meadows. <br><br>Phone: 920/361-3149 <br><br>Web: www.dnr.wi.gov <br><br>Signature Species: Bald Eagle & Osprey <br><br>Rare Species: Common, Black & Forester・・s Terns <br><br>Gazetteer: Page 44, A-2 <br><br>Parking: Parking lots <br><br>Nearest food & lodging: Montello and Westfield",-89.296532,43.901727
Marquette,38. Mecan River State Fishery & Wildlife Area,0,"The beautiful Mecan River flows through this 740-acre property defining the landscape. The forested uplands offer nesting sites for warblers, woodpeckers and Ruffed Grouse. An occasional Bob-white Quail can be heard calling in the springtime. The marshlands are good places to look for turkeys and sedge wrens. The meadows shelter many species of grassland birds. The property is just north of the Mecan River Fisheries Area, so bring your fly rod and your canoe. In the early evening, look for red fox, coyotes, badgers, mink and fox squirrels along the roads. <br><br>Phone: 920-361-3149 <br><br>Web: www.dnr.wi.gov <br><br>Signature Species: Wild Turkey, Sandhill Crane & Ruffed Grouse <br><br>Rare Species: Loggerhead Shrike, Bob-white Quail & Northern Saw-whet Owl <br><br>Gazetteer: Page 44, A-2 <br><br>Parking: Parking lots <br><br>Nearest food & lodging: Westfield and Montello",-89.350948,43.949945
Marquette,39. Muir Park State Natural Area,0,"Muir Park is the boyhood home of conservationist John Muir, founder of the Sierra Club and the father of the National Park System. This 150-acre property is within John Muir Memorial County Park. It consists of upland and wetland communities surrounding 30-acre Ennis Lake. Small fens along the shoreline and an outlet stream to the Fox River contain many unusual plants, including nodding lady・・s-tresses orchid. The restored prairie is a magnet for grassland birds such as Bobolinks, while the oak savannas are rich in warblers and other migrating songbirds. A trail takes you around the lake and wooden bridges carry you over wet areas and streams. <br><br>Phone: 920/787-4686 <br><br>Web: www.dnr.wi.gov <br><br>Signature species: Pileated Woodpecker, Yellow-bellied Flycatcher & Eastern Kingbird <br><br>Rare species: Red-headed Woodpecker, Acadian Flycatcher, Bob-white Quail <br><br>Gazetteer: Page 44, C-1 <br><br>Parking: Parking lot <br><br>Nearest food & lodging: Endeavor or Montello",-89.394035,43.684136
Marquette,40. Observatory Hill State Natural Area,0,"Observatory Hill is the highest point in Marquette County, rising 300 feet above the countryside. It was a favorite childhood haunt of naturalist John Muir who lived nearby. A trail leads to the top where you can immerse yourself in the beauty of this Central Wisconsin landscape. The woods that cover the property are being restored to oak savanna. It contains remnant prairie plants. The mix of oaks, basswoods and cedar trees attract many species of songbirds including Scarlet Tanagers, Cedar Waxwings, Red-eyed vireos, and Golden-crowned Kinglets. <br><br>Phone: 920/787-4686 <br><br>Web: www.dnr.wi.gov <br><br>Signature species: Turkey <br>Vulture, Bald Eagle & Eastern Phoebe <br><br>Rare species: Loggerhead Shrike, Warbling Vireo & Redheaded Woodpecker <br><br>Gazetteer: Page 44, C-1 <br><br>Parking: Parking lot <br><br>Nearest food & lodging: Endeavor or Montello",-89.341164,43.700892
Menominee,41. Menominee County,0,,-88.74777,45.030474
Monroe,42. Big Creek State Fishery Area,0,"Big Creek meanders through this 1,316-acre property managed for trout fishing, hunting, hiking and wildlife viewing. The forests and lowland brush areas attract a variety of birds. Look for Yellow-bellied Flycatchers, Brown Thrashers and Gray Catbirds in the shrubs along the creek with Eastern Bluebirds and Savannah Sparrows in the meadows. Forested sections hold Yellow-bellied Sapsuckers, Whip-poorwills, Nashville and Black-and-white Warblers. Blaze your own trail through this area, keeping an eye open for badgers and fox in the meadows, and mink along the creek. For anglers, Big Creek produces some nice trout. <br><br>Phone: 608/785-9000 <br><br>Web: www.dnr.wi.gov <br><br>Signature Species: Bald Eagle, Ruffed Grouse & Wild Turkey <br><br>Rare Species: Hooded Warbler, Clay-colored Sparrow & Lincoln・・s Sparrow <br><br>Gazetteer: Page 50, D-1 <br><br>Seasonality: Open all year <br><br>Parking: Parking lot <br><br>Nearest food & lodging: Sparta",-90.851269,44.0919
Monroe,43. Fort McCoy (Military Reservation) Barrens State Natural Area,0,"While this property is a heavily used military base, there are many rare species of plants and animals found here. This SNA protects an oak barrens of exceptional quality and diversity. Much of the area is open, sandy prairie with groves and scattered trees of black, Hill・・s, bur, and white oaks. Several large sand blows are habitat for prairie fame-flower and prairie larkspur. Avian life is equally diverse and includes Upland Sandpipers and Grasshopper Sparrows. <br><br>Phone: 608/388-5766 or 5374 ・・ visitors must call in advance for access permission <br><br>Web: www.dnr.wi.gov <br><br>Signature species: Eastern Bluebird, Sedge Wren, Lark Sparrow, Turkey Vulture & Karner Blue Butterfly <br><br>Rare Species: Red-headed Woodpecker, Vesper and Henslow・・s Sparrows, Bobolink and Western Meadowlark <br><br>Gazetteer: Page 41, A-5 <br><br>Seasonality: Open all year <br><br>Parking: Parking lots <br><br>Nearest food & water: Sparta",-90.720978,43.955506
Monroe,44. La Crosse River State Fishery Area,0,"This 457-acre property is northeast of the La Crosse River Trail Prairie State Natural area and is dominated by the La Crosse River. The landscape is ideal for Wild Turkeys, badgers, mink and red fox. Shrubby areas along the stream attract Brown Thrashers, Yellow and Common Yellowthroat Warblers while the forests harbor a variety of woodpeckers, warblers and the Hermit Thrush. Blue-winged, Golden-winged and Chestnut-sided Warblers nest on this property along with Yellow-rumped Warblers. If you like to fish for trout, or just relax along the river, this property is a great place to visit. <br><br>Phone: 608/785-9000 <br><br>Web: www.dnr.wi.gov <br><br>Signature species: Belted Kingfisher, Eastern Wood Pewee, Eastern Kingbird, Northern Flicker, Long-billed Marsh & Sedge Wren <br><br>Rare species: Pileated Woodpecker, Acadian Flycatcher & Blue-gray Gnatcatcher <br><br>Gazetteer: Page 41, A-4 <br><br>Seasonality: Open all year <br><br>Parking: Parking lot <br><br>Nearest food & lodging: Sparta",-90.738831,43.988615
Monroe,45. La Crosse River Trail Prairie State Natural Area,0,"This property is located along the La Crosse River State trail east and west of Rockland. It features two stretches of dry to dry-mesic sand prairie in a former railroad right-of-way that total 56 acres. These long, linear remnants lie on a sandy terrace of the La Crosse River and are indicative of the once vast prairie and savanna complex that covered this part of the state. Prairie meadows are in bloom from early spring to the last hard frost of October, attracting numerous species of butterflies and many species of grassland birds. This segment of the trail is drier than the La Crosse segment to the west, but you will want to walk or ride your bike and enjoy the beautiful landscape. <br><br>Phone: 608/785-9000 <br><br>Web: www.dnr.wi.gov <br><br>Signature species: Black & Yellow-billed Cuckoo, Chimney Swift, Least Flycatcher & Eastern Kingbird <br><br>Rare species: Red-headed Woodpecker, Acadian Flycatcher & Purple Martin <br><br>Gazetteer: Page 41, A-4 <br><br>Seasonality: Open all year <br><br>Parking: Parking lots <br><br>Nearest food & lodging: Sparta <br><br>Fees: Bike trail fee",-90.880451,43.919164
Monroe,46. Meadow Valley State Wildlife Area,0,"This 58,000-acre site features eight flowages, 1,000 acres of open water, a waterfowl refuge, 6 miles of public use roads, 9 primitive campground sites and 25 miles of snowmobile trails available for hiking. It is managed for the optimum production of forest and wetland wildlife, and is a popular place to view wildlife, hunt and fish. Moist soil management allows two or three impounded water drawdowns each year, providing excellent habitat for shorebirds. This large property extends into Juneau County to the east. Interesting and elusive mammals here include gray fox and snowshoe hares. <br><br>Phone: 715/884-2437 <br><br>Web: www.dnr.wi.gov <br><br>Signature species: Sandhill Crane, Ruffed Grouse, Barred Owl, Bank and Cliff Swallow & Whip-poor-will. <br><br>Rare species: Whooping Crane, American Egret, Trumpeter Swans, Yellow-billed Cuckoo & Karner Blue Butterfly <br><br>Gazetteer: Page 51, D-5 <br><br>Seasonality: Open all year <br><br>Parking: Parking lots <br><br>Nearest food & lodging: Necedah",-90.371132,44.086599
Outagamie,47. Bubolz Nature Preserve,0,"This 758-acre nature preserve has 8 miles of wildlife viewing trails that access fields and a large wetland area, all of which was once a cedar swamp. The earth sheltered nature center offers guided tours, workshops, classes and programs hosted by staff naturalists. Watch for Bobolinks and Meadowlarks as you hike the grassy fields in the summer. In the fall, look for low-flying Northern Harriers hunting for small mammals. An evening walk through the preserve may produce white-tailed deer or a red fox. <br><br>Phone: 920/984-3700 <br><br>Web: www.bubolzpreserve.org <br><br>Signature Species: Monarch Butterfly & Yellow-bellied Sapsucker <br><br>Rare Species: Pileated Woodpecker, Scarlet Tanager & Merlin <br><br>Gazetteer: Page 55, 5-B <br><br>Seasonality: Year round - nature center closed Mondays <br><br>Parking: Parking Lot <br><br>Nearest Food & Lodging: Appleton",-88.47084,44.316848
Outagamie,48. Mack State Wildlife Area & DOT Mitigation Site,0,"This 1,350-acre property is actually two sites; one north and one south of Hwy 54. The property contains marsh, aspen, swamp, hardwood forests, lowland brush and grasslands. An abandoned railroad bed that is slated to become a state trail for hiking and biking bisects the southern section of the property. The area is fairly flat as it was once a glacial lakebed. The 480-acre mitigation site located on Van Patten Drive is north of Hwy 54. Visit the accessible viewing platform and educational kiosk found there to get a bird・・s eye view of a wetland and wetland birds. <br><br>Phone: 715/524-2183 <br><br>Web site: www.dnr.wi.gov <br><br>Signature Species: Black Tern, Tundra Swan, Yellow-headed Blackbird & Sora Rail <br><br>Rare Species: Great Egret <br><br>Gazetteer: Page 54, A-4 <br><br>Seasonality: Open all year <br><br>Parking: Parking lots <br><br>Nearest Food & Lodging: New London",-88.519764,44.462823
Outagamie,49. Outagamie County State Wildlife Area,0,"This 1,000-acre property allows more access to the many-faceted Wolf River. Trails lead through forest, marsh and grasslands along the river where you can observe waterfowl during migrations. Or, a hike into the swamps can produce a variety of herons and even Black Terns. The terns can be heard calling continually as they swoop and bob above the water hunting insects. Yellowheaded Blackbirds call from their cattail stands as well. Listen for Longbilled Marsh Wrens in the marshes and Sedge Wrens in the grassy uplands. <br><br>Phone: 715/524-2183 <br><br>Web: www.dnr.wi.gov <br><br>Signature Species: Ruffed Grouse, Blue-gray Gnatcatcher and Cerulean Warbler <br><br>Rare Species: Osprey and Black Terns <br><br>Gazetteer: Page 54, A-4 <br><br>Seasonality: Open all year <br><br>Parking: Parking lots <br><br>Nearest Food & Lodging: Shiocton",-88.574181,44.492832
Outagamie,50. Wolf River Bottoms State Wildlife Area,0,"The Wolf River dominates this 2,600-acre property supplying ample water in the spring to fill the wetlands and temporarily flood the lands surrounding the property. All of this water draws in impressive numbers of ducks, geese, swans and shorebirds in April and May. As spring gives way to summer, the meadows and woods teem with warblers and many species of songbirds, while broods of ducks begin to show themselves in the marshes. In the fall, bird migrations can be exciting as well. The area is remote and well worth repeated visits. <br><br>Phone: 715/524-2183 <br><br>Web: www.dnr.wi.gov <br><br>Signature Species: Sandhill Cranes, Ruffed Grouse & American Woodcock <br><br>Rare Species: Loggerhead Shrike & Prothonotary Warbler <br><br>Gazetteer: Page 66, D-3 <br><br>Seasonality: Open all year <br><br>Parking: Parking lots <br><br>Nearest Food & Lodging: Shiocton or Hortonville",-88.598385,44.508381
Portage,51. Buena Vista Grasslands,0,"This 11,300-acre site is a mix of stateowned and leased lands scattered over 88 square miles. It is home to then largest concentration of Greater Prairie Chickens in Wisconsin. Buena Vista represents one of the most extensive grasslands east of the Mississippi River. The area has been developed by the DNR, the Dane County Conservation League and the Society of Tympanuchus cupido pinnatus. In the process of preserving the land for Prairie Chickens, habitat has been developed for a broad array of rare and uncommon birds. Also found within the project are wetlands and nesting Northern Harriers, Sandhill Cranes, Willow Flycatchers and Brown Thrashers. <br><br>Phone: 608/339-3385 <br><br>Web: www.dnr.wi.gov <br><br>Signature species: Greater Prairie Chicken <br><br>Rare species: Cattle Egret, Golden Eagle, Snowy and Shorteared Owl, Acadian Flycatcher, Henslow・・s Sparrow & Bobolink <br><br>Gazetteer: Page 52, B-4 <br><br>Seasonality: Open all ",-89.637794,44.33269
Portage,52. Dewey Marsh State Natural Area,0,"Located within the 5,677-acre Dewey Marsh State Wildlife Area, this 926-acre State Natural Area (SNA) contains an expansive conifer swamp, northern sedge meadow and bog embedded with small islands forested with aspen, birch, red maple, and white pine. The sedge meadow forms the headwaters of Hay Meadow Creek. There are areas of conifer swamp containing tamarack and black spruce. During fall migrations, Shorteared Owls can be seen in small flocks. In the winter, look for Pileated Woodpeckers as they fly from woodlot to woodlot. Red Crossbills and Whitewinged Crossbills can be found in the conifer swamps. All summer long, a wide array of songbirds and grassland species nest in this unique site. <br><br>Phone: 715/421-7800 <br><br>Web: www.dnr.wi.gov <br><br>Signature species: Northern Harrier, Ruffed Grouse, Grasshopper, Vesper & Savannah Sparrow <br><br>Rare species: Sharp-tailed Grouse & Greater Prairie Chicken <br><br>Gazetteer: Page 64, C- 4 <br><br>Seasonality: Open year round ・・ some roads impassable in winter <br><br>Parking: Park along the road <br><br>Nearest ",-89.572649,44.637269
Portage,53. Iverson Park,0,"With more than 200 species on its bird list, this park is the place to go for a great urban wildlife experience in Stevens Point. The 121-acre park is located along the Plover River that serves as a major migratory corridor for birds in the spring and fall. The property consists of deciduous and conifer forests, extensive wetlands, the Plover River, and McDill Pond. Many hiking trails traverse the property. There are picnic areas, park shelters and playground equipment for the kids. In winter, the trails are a popular with crosscountry skiers. The city・・s 24-mil",-89.538918,44.521479
