county,Name,SymbolID,site_desc,lon,lat
Portage,54. Richard A. Hemp State Fishery Area,0,"This 1,375-acre site is one of the best warbler habitats in Wisconsin. Of the 30 species seen on the property, a total of eighteen have been documented as breeders. The combination of forested, river and wetland habitats makes this a special place. This site is considered semi-wilderness and is a great property to visit. The maple forests and river areas produce an exceptional spring wildflower display. Skunk cabbage bloom first (late winter) followed by marsh marigolds, may apples and trillium. The spring frog chorus can be deafening, as huge numbers of spring peepers, chorus, green and gray-tree frogs sing from spring through summer. <br><br>Phone: 715/421-7800 <br><br>Web: www.dnr.wi.gov <br><br>Signature species: Blue-winged, Golden-winged & Hooded Warblers, Willow & Alder Flycatchers, Eastern Kingbird <br><br>Rare species: Karner Blue Butterfly, Golden Eagle, Common Raven & Louisiana Waterthrush <br><br>Gazetteer: Page 65, D-6 <br><br>Seasonality: Open all year <br><br>Parking: Parking areas <br><br>Nearest food & lodging: Amherst Junction or Stevens Point",-89.320951,44.548735
Portage,55. Schmeeckle Reserve,0,"This 275-acre reserve on the campus of UW-Stevens Point is a College of Natural Resources field station, providing rich learning and research opportunities for faculty and students. It is located on the north side of the city and serves as a trailhead for the Green Circle Trail that circumnavigates the city. The habitat is diverse with mixed conifer and deciduous forests, wetlands, a small woodland stream and 24- acre Joanis Lake. The Reserve offers 5.5 miles or trails. Its bird list is an impressive 218 species, with 33 species of mammals recorded on the site. In the spring, the amphibian chorus of frogs and toads sing nightly. The reserve・・s visitor・・s center houses the Wisconsin Conservation Hall of Fame. <br><br>Phone: 715/",-89.564924,44.539896
Shawano,56. Jung Hemlock-Beech Forest State Natural Area,0,"This State Natural Area is a remnant of the northern mesic forest that once covered millions of acres of northeastern Wisconsin. There are old-growth hemlock, American beech, sugar maple, yellow birch and scattered white pine trees that are 150-200 years old. The rich ground layer of plants includes bluebead-lily, wintergreen and beechdrops, a root parasite of beech trees. Small sedge-sphagnum bogs contain tamarack and black spruce. Wetlands contain bog-laurel, mountain holly, cotton grass and pitcher plants. Nesting birds fill the property with song in the spring. <br><br>Phone: 715/524-2183 <br><br>Web: www.dnr.wi.gov <br><br>Signature Species: Wood Thrush, Red-eyed Vireo & Eastern Wood Pewee <br><br>Rare Species: Red and White Crossbills & Blue-headed Vireo <br><br>Gazetteer: Page 66, B-2 <br><br>Seasonality: Open all year <br><br>Parking: Parking area <br><br>Nearest Food & Lodging: Gresham",-88.794422,44.808635
Shawano,58. Navarino State Wildlife Area &Nature Center,0,"This 15,000-acre property is a mix of prairie, woodlands, marshes and flowages. The Wolf and Shioc Rivers shape the character of this landscape that is home to many species of native mammals including badgers, coyotes, porcupines and beavers. A nature center offers visitors educational opportunities and there are programs led by staff naturalists. There are prairie restorations to explore, or enjoy a 47- mile, self-guided auto tour of the property. Drives through the area in the early evening produce many sightings of deer, or you might hear the call of a Great Horned or Barred Owl. <br><br>Phone: 715/758-6999 <br><br>Web: www.navarino.org <br><br>Signature Species: Northern Harrier, Eastern Bluebird, Tundra Swan & American Bittern <br><br>Rare Species: Loggerhead Shrike & Little Blue Heron <br><br>Gazetteer: Page 66, 4-C <br><br>Seasonality: Open all year <br><br>Parking: Parking Lots <br><br>Nearest Food & Lodging: Shawano or Bonduel",-88.53208,44.633192
Shawano,59. Shawano Lake,0,"At 6,178 acres, Shawano Lake is part of a 62 square mile watershed within the Wolf River Basin. It is heavily used yearround for recreation. It is significant to wildlife, especially during spring and fall migrations when waterfowl of all types can be found on the lake. There are good roads around the lake that lead to five boat launches. Fishing on the lake has always been good; wet a line for walleye, northern, large-mouth bass and panfish. The county park at the north end of the lake contains woodlands where you can find Redheaded Woodpeckers. American White Pelicans and Tundra Swans can be found on the lake in the spring.<br><br>Phone: 715/524-4162<br><br>Web: www.co.shawano.wi.us<br><br>Signature Species: Yellowheaded blackbird & Common Loon<br><br>Rare Species: Red-headed Woodpecker<br><br>Gazetteer: Page 66, B-4<br><br>Seasonality: Open all year<br><br>Parking: Parking lots<br><br>Nearest food & lodging: Shawano",-88.518391,44.807904
Waupaca,60. Hartman Creek State Park,0,"With several quiet lakes to explore, these two properties are popular destinations for canoeists and kayakers. Hikers and birders enjoy the trails that traverse these 2,800 acres, including parts of the Ice Age National Scenic Trail. The properties offer a mix of habitats including pine and hardwood forests, oak savannas, old fields, marshes, lakes, and upland meadows. This variety attracts lots of birds; the bird list for the properties is an impressive 253 species. Volunteer naturalists at the park offer interpretive programs throughout the summer. <br><br>Phone: 715/258-2372 <br><br>Web: www.dnr.wi.gov <br><br>Signature Species: Scarlet Tanager, Least Flycatcher, Redtailed Hawk, American Kestrel & Karner Blue Butterfly <br><br>Rare Species: Acadian Flycatcher, Grasshopper Sparrow & Henslow・・s Sparrow <br><br>Gazetteer: Page 53, 7-B <br><br>Seasonality: Open all year <br><br>Parking: Parking lots <br><br>Nearest Food & Lodging: Waupaca <br><br>Fees: Park fees apply",-89.213972,44.32687
Portage,60. Emmons Creek Fishery Area,0,"With several quiet lakes to explore, these two properties are popular destinations for canoeists and kayakers. Hikers and birders enjoy the trails that traverse these 2,800 acres, including parts of the Ice Age National Scenic Trail. The properties offer a mix of habitats including pine and hardwood forests, oak savannas, old fields, marshes, lakes, and upland meadows. This variety attracts lots of birds; the bird list for the properties is an impressive 253 species. Volunteer naturalists at the park offer interpretive programs throughout the summer. <br><br>Phone: 715/258-2372 <br><br>Web: www.dnr.wi.gov <br><br>Signature Species: Scarlet Tanager, Least Flycatcher, Redtailed Hawk, American Kestrel & Karner Blue Butterfly <br><br>Rare Species: Acadian Flycatcher, Grasshopper Sparrow & Henslow・・s Sparrow <br><br>Gazetteer: Page 53, 7-B <br><br>Seasonality: Open all year <br><br>Parking: Parking lots <br><br>Nearest Food & Lodging: Waupaca <br><br>Fees: Park fees apply",-89.232159,44.30782
Waupaca,61. Keller Whitcomb Creek Woods State Natural Area,0,"This 97-acre SNA includes the headwaters of Whitcomb Creek, a sandy-bottomed, fast flowing, Class 1 trout stream with naturally reproducing brown and brook trout. The property・・s northern dry-mesic forest of white pine, red pine, red oak and white oak grades into a mesic forest of hemlock, yellow birch, paper birch, and sugar maple. Low areas near the stream consist of almost pure white cedar. The ground layer contains many species of ferns and fungi. Mink, red fox and reptiles use the area, along with a wide variety of songbirds including Mourning, Nashville and Yellow-rumped Warblers, Ovenbirds, Northern Waterthrush and White-throated Sparrows. <br><br>Phone: 920/787-4686 <br><br>Web: www.dnr.wi.gov <br><br>Signature Species: Winter Wren, Common Raven, Hermit Thrush & Veery <br><br>Rare Species: Red-shouldered Hawk, Yellow-bellied Flycatcher, & Merlin <br><br>Gazetteer: Page 65, D-8 <br><br>Seasonality: Open all year <br><br>Parking: Parking along road <br><br>Nearest Food & Lodging: Iola",-89.056034,44.5868
Waupaca,62. Mukwa State Wildlife Area,0,"This 1,290-acre property is a large complex of marsh, river and woods. Some of the river bottom areas are important to spring songbirds while the backwater areas attract many waterfowl species, especially in the spring. Barred and Great Horned Owls nest in the woods and Belted Kingfishers dive for minnows from trees overhanging the water. Tundra Swans can be seen during the fall migration along with numerous species of herons and geese. There are many well-marked access points where you can launch your canoe or kayak for a lazy paddle on the water. Look for mink, muskrat, woodchucks and badgers. <br><br>Phone: 920/787-4686 <br><br>Web: www.dnr.wi.gov <br><br>Signature Species: Osprey, Bald Eagle, Northern Harrier & American Kestrel <br><br>Rare Species: Northern Shrike, Least Bittern & Great Egret <br><br>Gazetteer: Page 54, A-2 <br><br>Seasonality: Open all year <br><br>Parking Lot: Parking lots provided <br><br><br>Nearest Food & Lodging: New London",-88.786011,44.392089
Waupaca,63. Myklebust Lake State Natural Area,0,"Myklebust Lake is a deep, 20-acre, marl-bottom lake with undeveloped shoreline and remarkably clear, alkaline water supplied by numerous springs. A small outlet stream feeds the South Branch of the Little Wolf River. White water-lily and bull-head lily bloom here along with many other wetland plants, including wild rice. A northern wet forest of tamarack, red maple and elm borders the outlet stream. A two-acre black spruce bog occupies the southeast corner of the property. The east shore is dominated by a small stand of old white pine, some more than 2 feet in diameter. The uniqueness of the property attracts many species of birds and mammals. <br><br>Phone: 920/787-4686 <br><br>Web: www.dnr.wi.us <br><br>Signature Species: Mourning Warbler, Pileated Woodpecker & Yellow-throated Vireo <br><br>Rare Species: Northern Waterthrush, Least Bittern & Great Egret <br><br>Gazetteer: Page 53, A-7 <br><br>Seasonality: Open all year <br><br>Parking Lot: Parking area <br><br>Nearest Food & Lodging: Iola",-89.129677,44.493505
Waupaca,64. Waupaca County Sturgeon Trail,0,"In April and May, Lake Sturgeon spawn here in this shallow, rocky stretch of the Wolf River. The Sturgeon is Wisconsin・・s oldest and largest fish. In 2001, the Wisconsin DNR paved a half-mile of surface trail along the river to make it easy and safe for people to observe these ancient creatures. The site is completely accessible. While you・・re in the area, look for waterfowl during spring and fall migrations, and scan the trees for songbirds. Plans call for trail expansion in the future. This site is always good for wildlife viewing, even when the sturgeon viewing season ends. <br><br>Phone: 715/258-6243 <br><br>Web: www.waupacacountyparks.com <br><br>Signature Species: Lake Sturgeon, waterfowl, songbirds & herons <br><br>Gazetteer: Page 54, A-2 <br><br>Seasonality: Open all year <br><br>Parking: Signs mark parking lots <br><br>Nearest Food & Lodging: New London",-88.774252,44.399694
Waushara,65. Greenwood State Wildlife Area,0,"This site is 1,438 acres of restored oak savanna and prairie, partly done to save the endangered oak savanna community, and partly to encourage its Karner Blue Butterfly population. The prairie habitat is vital nesting cover for Bobolinks, Grasshopper, Field and Vesper Sparrows, and both Eastern and Western Meadowlarks. Look for Karner Blue Butterflies in June and July where lupine plants mix with the stands of prairie grasses. Intermixed with beautiful prairie wildflowers are monarch butterflies and prairie mammals like 13-lined ground squirrels and badgers. You can also hike the Ice Age Trail at this site. <br><br>Phone: 920/424-3050 <br><br>Web: www.dnr.wi.gov <br><br>Signature Species: Ruffed Grouse & Sandhill Crane <br><br>Rare Species: Bob-white Quail & Karner Blue Butterfly <br><br>Gazetteer: Page 53, C-5 <br><br>Seasonality: Open all year <br><br>Parking: Parking lots <br><br>Nearest Food & Lodging: Hancock",-89.493599,44.103489
Waushara,66. Karner Blue Meadow State Natural Area,0,"This 40-acre property provides dry, sandy, prairie habitat for a large population of the federally endangered Karner Blue Butterfly. Wild lupine, the only plant the butterfly・・s larvae feed on, grows here in abundance. Other flowering prairie plants, such as rough blazing- star, black-eyed Susan, and New Jersey tea, supply nectar for adult Karner blues. The tiny butterfly, with a wingspan of only 1 inch, produces two adult generations each year, each living only about a week. Typically, early June and the end of July are the best times to see this beautiful butterfly. <br><br>Phone: 920/787-4686 <br><br>Web: www.dnr.wi.gov <br><br>Signature Species: Karner Blue Butterfly <br><br>Rare Species: Yellow-billed Cuckoo <br><br>Gazetteer: Page 53, C-7 <br><br>Seasonality: Open all year <br><br>Parking: Parking area on SE corner of site <br><br>Nearest Food & Lodging: Wild Rose & Wautoma",-89.197483,44.177033
Waushara,67. Mecan Springs & River State Fishery Area,0,"With seven lakes, Mecan Spring and the Mecan River, marshes, woodland and upland grasslands, this is a beautiful site to visit at any season. Bald Eagles nest in the area, and there are good opportunities to view many species of songbirds, herons and waterfowl of all kinds. Occasional flocks of American White Pelicans can be seen in the spring. As you drive the area, consider stopping at boat access points to check for birds. Trout anglers love this river; its clear, cold water produces some fine fish. Kayaks and canoes are a great way to explore these quiet waters and to view the waterfowl they harbor. <br><br>Phone: 920/424-3050 <br><br>Web: www.dnr.wi.gov <br><br>Signature Species: Bald Eagle & Red-tailed Hawk <br><br>Rare Species: Red-headed Woodpecker & Red-shouldered Hawk <br><br>Gazetteer: Page 53, D-5 <br><br>Seasonality: Open all year <br><br>Parking: Parking areas <br><br>Nearest Food & Lodging: Wautoma",-89.458752,44.049966
Waushara,68. Mount Morris Hills Park,0,"This county park is a good place to visit in every season. In springtime, the wildflowers are in bloom and warblers and other songbirds are passing through. In summer, it・・s a great place to hike and look for nesting birds, or bring your canoe and paddle Lake Morris in search of marsh birds and herons. In fall, the colorful leaves of the park・・s hardwood trees make it a must for a day trip. Turkey vultures glide on the thermals created around the large hill that rises sharply above Lake Morris. Hawks in migration are seen in good numbers at this park in the fall. Take a drive to the top of the hill and watch the hawks move. <br><br>Phone: 920/787-0431 <br><br>Web: www.1waushara.com/ <br><br>Signature Species: Turkey Vulture, Eastern Phoebe, & Pileated Woodpecker <br><br>Gazetteer: Page 53, C-7 <br><br>Seasonality: Open all year <br><br>Parking: Parking lot <br><br>Nearest Food & Lodging: Wautoma",-89.194908,44.118772
Waushara,69. Poygan State Wildlife Area,0,"This large 3,282-acre property lies at the western end of Lake Poygan. The Pine River runs through the area as does Willow Creek. The extensive marsh draws all types of waterfowl, herons and shorebirds. The property has many dikes that lend themselves to hiking and allow you to go just about anywhere on the property. Hunting is popular at this site in the fall, so wildlife viewing is best from one・・s car during this time. The wooded part of the property is located along Beaver Road; this is the best area to find warblers, flycatchers, woodpeckers and other birds. Gulls and waterfowl can be seen from the boat access point at Badger Drive. <br><br>Phone: 920/424-3050 <br><br>Web: www.dnr.wi.gov <br><br>Signature Species: Bald Eagle & Osprey <br><br>Rare Species: Least Bittern & American Woodcock <br><br>Gazetteer: Page 54, D-1 <br><br>Seasonality: Open all year ・・ rain & snow may close roads <br><br>Parking: Parking lots <br><br>Nearest Food & Lodging: Poy Sippi & Wautoma",-88.922825,44.131587
Waushara,70. Wild Rose Fish Hatchery,0,"Don・・t be fooled; birding is great at this beautiful property where mature trees and the Pine River attract a nice variety of birds. The hatchery is critical to Wisconsin・・s $2.3 billion sport fishery producing 27 percent of the trout and salmon the DNR stocks; 64 percent of northern pike; 100 percent of lake sturgeon stocked, and 100 percent of spotted musky. Ninety-four percent of the fish, mostly Brown trout and Chinook salmon, raised at this site go to Lake Michigan. The century-old hatchery is currently undergoing a $24.3 million dollar renovation. The new Visitor Center opened in 2007 to welcome the public to learn more about the resource. <br><br>Phone: 920/424-3050 <br><br>Web: www.dnr.wi.gov <br><br>Signature Species: Trout, salmon, lake sturgeon, northern pike & spotted musky <br><br>Gazetteer: Page 54, C-6 <br><br>Seasonality: Open all year <br><br>Parking: Parking lot <br><br>Nearest Food & Lodging: Wild Rose",-89.252329,44.188297
Winnebago,71. Oshkosh-Larsen Trail Prairies,0,"This site is a series of three low prairie remnants along a 4-mile segment of the Wiouwash State Trail centered on Allenville. The Wiouwash begins in Oshkosh and travels 22 miles north to Hortonville. The prairie segments total just 32 acres, but contain a diversity of native prairie species. Grasses include little blue-stem, Indiangrass, prairie drop-seed, and prairie cord grass. Wildflowers bloom throughout the growing season and include blazingstar, Riddell・・s goldenrod, downy gentian, stiff gentian and more. Listen for the songs of Eastern Meadowlarks and the call of American Goldfinches overhead. <br><br>Phone: 920/424-7896 <br><br>Web: www.dnr.wi.gov <br><br>Signature Species: Song Sparrow, Sedge Wren, American Goldfinch & American Tree Sparrow <br><br>Rare Species: Bobolink, Eastern Meadowlark & Short-eared Owl <br><br>Gazetteer: Page 54, C-4 <br><br>Seasonality: Open all year <br><br>Parking: Parking area <br><br>Nearest food & lodging: Oshkosh <br><br>Fee: Trail Pass Fee",-88.624392,44.130232
Winnebago,73. Rush Lake State Natural Area,0,"Because of its rich wildlife population, this property is one of the state・・s most importa",-88.81588,43.92819
Winnebago,74. Wolf River State Wildlife Area,0,"Water shapes Winnebago County. This 1,620-acre property is a good example of how water is captured, filtered and renewed by vast wetlands. The bird and animal life here is extensive. The Wolf River SWA offers the birder good opportunities to experience the Wolf River and its delta on Lake Poygan by kayak or canoe. Ashore, there arehiking trails that take you close to the river and into marshy areas. This property is a favorite with anglers and hunters. In dry years, spring and fall shorebirds can be numerous here as they search the mudflats for insects. Overhead, soaring Bald Eagles and Osprey hunt for fish. <br><br>Phone: 920/424-7896 <br><br>Web: www.dnr.wi.gov <br><br>Signature Species: Great Blue Heron, Canada Goose, American Black Duck & Belted Kingfisher <br><br>Rare Species: Least Bittern, American Egret & American  White Pelican <br><br>Gazetteer: Page 54, C-2 <br><br>Seasonality: Open all year <br><br>Parking: Parking lots <br><br>Nearest food & lodging: Winneconne",-88.812447,44.206327
Wood,75. Paul Olson State Wildlife Area,0,"The second-largest population of Greater Prairie Chicken in the state is found on Paul Olson. This 1,650-acre property is one of four core management areas for the Greater Prairie Chicken in central Wisconsin and ranks as an Important Bird Area. The property is broken into two locations: one in Wood County and the other in Portage County. The landscape is flat and mostly agricultural, but there are scattered sedge meadows, old fields, swamps and woodlands. This is also a great place to find Sedge Wrens, Clay-colored, Savannah, and Vesper Sparrows. While driving the many roads in the area, look for Northern Harriers hunting over meadows. <br><br>Phone: 715/421-7800 <br><br>Web: www.dnr.wi.gov <br><br>Signature Species: Greater Prairie Chicken, Bobolink & Upland Sandpiper <br><br>Rare Species: Whooping Crane <br><br>Gazetteer: Page 52, A-2 <br><br>Seasonality: Open all year <br><br>Parking: Parking provided <br><br>Nearest food & lodging: Wisconsin Rapids",-89.895029,44.519582
Wood,76. Powers Bluff Maple Woods State Natural Area & Powers Bluff County Park,0,"This property is perched atop a 300-foot-high hill of quartzite. A rich southern mesic forest of sugar maple, yellow birch, bitternut hickory, ash and basswood covers the slopes. In spring, the forest floor is carpeted with wildflowers and ferns including bloodroot, hepatica, blue cohosh, and violets. The area supports a spectacular display of large-flowered trillium. On the south end of the property, you・・ll find quartzite rock outcrops covered with columbine and ferns. Bird life includes warblers, flycatchers and other neotropical migrants. This 70-acre site has a hiking trail through part of it for further exploration. <br><br>Phone: 715/884-2437 <br><br>Web: www.dnr.wi.gov <br><br>Signature species: Red-eyed Vireo & Ovenbird <br><br>Rare species: Woodland vole & Least Flycatcher <br><br>Gazetteer: Page 63, D-8 <br><br>Seasonality: Open all year <br><br>Parking: Parking area <br><br>Nearest food & lodging: Arpin or Marshfield",-90.06712,44.526986
Wood,77. Sandhill State Wildlife Area,0,"Sandhill Wildlife Area was formerly a <br>game farm developed by Wallace Grange for researching wildlife habitat restoration. His work focused on Sandhill Cranes and white-tailed deer. Grange conducted biological surveys and worked to restore this worn out land to pre-settlement conditions. Bobcats, badgers and many species of birds call this 9,150-acre area home. Flat marshy areas, wooded uplands, and old fields cover the property. The Sandhill Outdoor Skills Center hosts workshops and tours for the public. The Trumpeter Trail, a 14-mile auto or bike tour, takes you throughout the property. There are three observation decks, one that overlooks a bison range. <br><br>Phone: 715/884-2437 <br><br>Web: www.dnr.wi.gov <br><br>Signature Species: Ruffed Grouse, Bald Eagle & Trumpeter Swan, & Sandhill Crane <br><br>Rare Species: Red-headed Woodpecker <br><br>Gazetteer: Page 51, B-7 <br><br>Seasonality: Open all year <br><br>Parking: Parking provided <br><br>Nearest food & lodging: Babcock or Pittsville <br><br>Fees: Donations accepted",-90.138617,44.309539
Wood,78. Wood County State Wildlife Area,0,"The water-rich marshes of this 19,303-acre property attract many species of birds including herons, rails, waterfowl and songbirds. Visit the grasslands in summer for a chance look at a Karner Blue Butterfly, or explore the woodlands for warblers, orioles and tanagers. This property has a small population of Sharp-tailed Grouse that populate the grasslands. Roads allow you to travel the property by car or bike; take Amundsen Road through the cranberry bogs for a chance to see Whooping Cranes. Birders use this property all year ・・round. <br><br>Phone: 715/884-2437 <br><br>Web: www.dnr.wi.gov <br><br>Signature Species: Ruffed and Sharp-tailed Grouse & Bald Eagle <br><br>Rare Species: Red-headed Woodpecker & Whooping Crane <br><br>Gazetteer: Page 51, B-7 <br><br>Seasonality: Open all year <br><br>Parking: Parking provided <br><br>Nearest food & lodging: Babcock or Pittsville",-90.14883,44.294981
